{
  "$schema": "https://json-schema.org/draft/2020-12/schema",
  "$id": "https://sg.local/contracts/grader-spec-v1.json",
  "title": "SG Task Grader Spec v1.0",
  "type": "object",
  "additionalProperties": false,
  "required": ["graderVersion", "graderId", "checks"],
  "properties": {
    "graderVersion": { "const": "1.0" },
    "graderId": { "type": "string", "pattern": "^[a-z][a-z0-9-]{1,63}$" },
    "title": { "type": "string", "minLength": 1 },
    "checks": {
      "type": "array",
      "minItems": 1,
      "items": {
        "type": "object",
        "additionalProperties": false,
        "required": ["id", "type", "weight", "required"],
        "properties": {
          "id": { "type": "string", "pattern": "^[a-z][a-z0-9-]{1,63}$" },
          "type": { "enum": ["data-pack-contract", "library-rules", "extract-equivalence", "command", "runtime-evidence", "visual-evidence"] },
          "weight": { "type": "number", "exclusiveMinimum": 0 },
          "required": { "type": "boolean" },
          "path": { "type": "string", "minLength": 1 },
          "scenarioId": { "type": "string", "minLength": 1 },
          "rulesPath": { "type": "string", "minLength": 1 },
          "dataPath": { "type": "string", "minLength": 1 },
          "configPath": { "type": "string", "minLength": 1 },
          "argv": { "type": "array", "minItems": 1, "items": { "type": "string" } },
          "cwd": { "type": "string", "minLength": 1 },
          "expectedExit": { "type": "integer", "minimum": 0, "maximum": 255 },
          "infraExitCodes": { "type": "array", "minItems": 1, "uniqueItems": true, "items": { "type": "integer", "minimum": 1, "maximum": 255 } },
          "timeoutMs": { "type": "integer", "minimum": 1, "maximum": 600000 },
          "maxOutputBytes": { "type": "integer", "minimum": 1024, "maximum": 16777216 },
          "strict": { "type": "boolean" },
          "ruleIds": { "type": "array", "items": { "type": "string", "minLength": 1 } }
        }
      }
    }
  }
}
